{
  "schema_name": "yara-x-live-synthetic-envelope-control",
  "schema_version": "1.0.0",
  "job_id": "live-literal",
  "profile_id": "yara-x-live-synthetic-envelope-v1",
  "profile_digest": "sha256:2aa5e203f71089688baa41556c6775e7dcca98c7e6aab726442ff99fb5f8cd26",
  "case_id": "literal",
  "launcher_path": "/synthetic/literal/launcher",
  "launcher_digest": "sha256:eeeeeeeeeeeeeeeeeeeeeeeeeeeeeeeeeeeeeeeeeeeeeeeeeeeeeeeeeeeeeeee",
  "executable_path": "/synthetic/literal/yr",
  "executable_digest": "sha256:bbbbbbbbbbbbbbbbbbbbbbbbbbbbbbbbbbbbbbbbbbbbbbbbbbbbbbbbbbbbbbbb",
  "ruleset_path": "/synthetic/literal/rules.yarc",
  "ruleset_digest": "sha256:cccccccccccccccccccccccccccccccccccccccccccccccccccccccccccccccc",
  "artifact_path": "/synthetic/literal/input",
  "artifact_digest": "sha256:1111111111111111111111111111111111111111111111111111111111111111",
  "artifact_bytes": "64",
  "job_root": "/synthetic/literal",
  "cgroup_leaf": "/sys/fs/cgroup/impresari/job-yara-live-literal",
  "external_canary": "/synthetic-external/canary",
  "credential_canary": "/synthetic-credential/canary",
  "write_probe": "/synthetic/literal/forbidden-write",
  "workspace_snapshot": "sha256:dddddddddddddddddddddddddddddddddddddddddddddddddddddddddddddddd",
  "manifest_id": "sha256:aaaaaaaaaaaaaaaaaaaaaaaaaaaaaaaaaaaaaaaaaaaaaaaaaaaaaaaaaaaaaaaa",
  "completed_at": "2026-08-31T00:00:00Z",
  "authority_added": false
}
